{
  "baseline_run_id": "baseline-run-123",
  "candidate_run_id": "candidate-run-456",
  "contributors": [
    {
      "raw_score": 1.5,
      "rows_credited": 2,
      "submission_ids": [
        "sub-a"
      ],
      "wallet": "0x1111111111111111111111111111111111111111",
      "weight_bps": 7500
    },
    {
      "raw_score": 0.5,
      "rows_credited": 1,
      "submission_ids": [
        "sub-b"
      ],
      "wallet": "0x2222222222222222222222222222222222222222",
      "weight_bps": 2500
    }
  ],
  "created_at": "2026-06-05T00:00:00Z",
  "method": "neighbor_provenance",
  "method_details": {
    "weight_kind": "knn_similarity"
  },
  "model_id": "30",
  "rows_improved": 2,
  "schema_version": "attribution_report/v1",
  "total_rows_evaluated": 10,
  "weight_bps_total": 10000
}
